{
  "artifacts": [],
  "catalogVersion": "1.0.0-100000-test",
  "collectibles": [],
  "equipment": [],
  "generatedAt": "2026-07-16T00:00:00.000Z",
  "managers": [
    {
      "canonicalId": "mgr-1",
      "name": "Test Manager"
    }
  ],
  "mines": [],
  "releaseId": "test-release",
  "research": [],
  "schemaVersion": "1.0.0",
  "source": {
    "apkHashes": {},
    "kind": "fixture",
    "parserVersion": "0.1.0",
    "versionCode": 100000,
    "versionName": "1.0.0"
  }
}
